label_bullying,text_message
0,I think the better question is will Rapattoni work at all on Mac? Geezzz - I hate change.  Especially change I don't want!
0,I agree & in fairness it's the smallest maternity shirt ever seen. I'm not fat  it's just the only empire waisted shirt my size.
0,Yes save my photos and show them to him when you really want to freak him out :P
0,Nope a regular blackberry. Damn this 5 year tmobile contract.
0,yeah that song suck  santagold sucks too. nice picture  i'm just seeing it  ur skin looks good
0,Books do kick ass!
0,I think I've fixed my problems..other than the brain problem I have..damn..the wind is blowing again.
0,damn! Do I want to come in tomorrow??
1,lets just hope i dont kick any ass. im in a violent mood.
1,yey for drunkenness! fuck drunk dialing or drunk texting! its all about the drunk tweeting!
1,hehe its all good. my drunken ass is moving off of twirl and to the crack...berry that is.  :) feel free to txt me yo. 3204694136
1,I hate when I text somebody and they immediately call me.  Hey fuckface  if I wanted to hear your ugly voice I would have called you!
1,did i jus get a reply from an emo asian!? CRAZY!
1,and yes.  true life "i have tourettes" is genius.  so is "i went to fat camp".  lmaooooooo
1,aliea you better stay away from jesse james joplin the third!!!!!!!!  i don't give a fuck  bitch
0,Fantastic! hung w/ sk8rs in HS =) fat shame about iphone 'nomo'4 us 2-all Christmas a blur. help? y my iphone twitpics sideways?
0,hate writing?  I LOVE writing :P  I'm contracted through January  but if you need a 2nd draft or something hit me up!
0,that is why we didn't "do" Santa. Giggles was afraid of the fat white guy busting into our house & doing "bad things"
0,i hate when i buy warranties then lose the warranty. The list goes on  I will reply with more when I think of more.
0,srsly why don't they reset the damn clock? Everyone I know does it :(
0,Damn dude the last 3 eps of TrueBlood are the best
0,"""its like it was a dream""....fag."
1,get on messenger already whore.
1,I just assumed when you said "meet" you mean suck his dick  cuz that's what you do when you go to "meet" people.
0,what'd you like/hate about the process?
1,no im just fucking pissed at shit
0,I hate wrapping  because I'm terrible at it. I always use gift bags. And you can use them again  so it environmentally correct.
0,hmm..maybe if you got off your computer and sat in front of it instead your ass wouldn't hurt.  &lt;O - )
1,Fuck that shit. She wasn't even right about the older men I was hitting on.
0,I'm up. See previous  my night sucks  tweet
0,I bet im not even famous and I've seen and experienced it its a damn shame
0,it sucks I dont even know what I did to cause the problem it started hurting monday and by wednesday sweeling up
0,no smart-ass  more than once a year  and believe me  she needs it. Even my cat is disgusted at Ela's personal hygiene issues.
0,hilary duff is great. don't let her giant veneers tell you otherwise. she's saying you're not gay.
1,LIKE YOU HATE A HUNDRED DOLLAR TIP. the other strippers must be SO JELLY. JAAAAY KAAAAAYYYYYY
1,OMFG. I JUST FIGURED OUT THAT @SHIT. AND MY FIRM'S IT GUY TRIED TO GET ME INTO CHUCK. IT'S REALLY NERD-O.
0,its a protest for the gay marriage ban in CA. Ppl are doing it all over the world
0,This place sucks get a good job so I can stay home please pretty please aww fuck it am begging you. Lmao
0, DAMN.  and I'm in Palm Springs for the holidays  go figure. Where will you post  Steve  when you get a few?
0,says the girl who throws a fit when someone calls her fat. Grow up.
0,ohhh fun are u eating roasted pig?
0,yes i hate the word GURU... Guess what I know label you a guru lol.. Let's put it on our signatures now and business cards lol
0,That sucks. I know the stress you're feelin all too well.
1,I wouldn't with ur dick! Now u owe me one!
1,like I said  I wouldn't even do it with your dick!
1,my dad started all this bullshit with my fam. He's such a fucking dumbass.
0,i just love that movie! damn it!
1,why do i imagine gouthami in police dress kannu adchifying and asking u for a lift! damn  i must stop these perverted thoughts!!!
1,lock it  yank his rights on both his accounts.  He's been a little bitch lately and I'm sick of it.
0,I HATE MY CPMOUTER it sed on stickie note that they changed stuff around and they did it happend to others :Sss
0,welcome back bitch!! We missed ya! :D
0,- You KNOW she doesn't.  She BARELY looks hapa. But LOL @ that one bitch from the one show.
0,wow  that's even worse than the blue screen of death from driver conflicts. I've been there too  though. It sucks.
0,dont hate me :(
0,video quality mostly sucks for screencasts. that was the reason for having the original source.
0,I can donate some booty as well. Ever heard of top ass? I got that and more.
0,color me shocked... I hate to think @islandcubfree had anything to do with this
0,dude  I'm not even in LA. I'm in cold ass Chicago. But  its nothing but a word if I was in LA.
0,UGH I do too. White decks are a bitch to play against. All the circles of poncey protection. I play black  red  or green or a combo
0,@jkjb98 NO FLASH? Fuck me running. I guess that's trade-off for video and sms pics. Can't have it all.
1,Then Clive is a total pussy and after reading his Dominion shit I do not believe that. Oh Clive so many missteps.
0,That's like comparing apples to oranges  but I STILL prefer twitter to FF. I hate FF with a burning passion.
0,OMG. Get him  honey! Flying Taintchoke his ass. Can't he read the fucking Shakesperean tragedy that is our server troubles?
0,It was pretty fucking cool when it wasn't driving me insane. I worked for Toonami and AS for 5 years.
0,Ugh. I fucking hate Ben 10. I remember how much bs it cause for my dept. when I was with CN.
1,fuck you
1,Maybe you should get your dick out of your ear next time I'm explaining them to you!!
1,Nerd.
0,not really. u see  my college is unfortunately a popular one and if i bitch  people will know who i am  so i need to be careful
0,Yes  that's the one. I refuse to believe Race had a baby w/anyone but Jezebel Jade. I hate his accent in RAJQ
0,yeah I've been to N.O. recently  damn shame.
0,hey man  i'd be screwed without slicehost's tutorial articles and creating new slices from backup images... I hate fresh setup.
0,Re : future - some ass.. kick it :D  btw ive caved in to fallout3 already
0,damn right. Unfairly maligned is the poor sardine.
0,damn right
0,RO quests are fucking LAME. Collect ELEVENTY BILLION OF THIS AND TEN THOUSAND OF THAT. You are a far more patient person than I.
0,Oh that sucks. Hmm  maybe you'll get sick and need another house call soon...
1,congrats on the Entrepreneur.com plug for Your Pitch Sucks http://bit.ly/pS0M !
0,did you like the patti labelle sing along too. even went on arsenio with hr and did that damn song. Singing???
0,i hate to say it but right now you are correct
0,Wow  that sucks. )c8 My condolences on your loss. I hope the HD springs back to life long enough to get the data back cheaply.
0,You're welcome. (c8 Wish I could've done something more. Losing a HD sucks. )c8 Do u have an external HD to backup to?
0,hiii lady! damn... i need some galoshes!
0,damn for real? That's news to me. I'm 100% sure that's a tape loop tho. Zig  Idris  Earl... N.O. Drummers&gt;everyone else
1,yo I will nerd out on this shit all day!
0,not even...its just too fucking cold out  im too fucking sick  and its too fucking cold in my basement!
0,aaaawwwww not the Rock em Sock em!! damn i think just drooled...
1,Fuck you and your worthless life
1,Bitch you will regret ever existing
1,That bastard deserves to rot in hell
1,The whore cannot even hide her shame
1,Slut go crawl back to your hole
1,I will kill you without hesitation
1,Go die alone nobody will miss you
1,He threatened to rape her in public
1,Shit like you should be burned alive
1,Asshole stop talking before I end you
1,His dick brain cannot think straight
1,Cunt get out before I slap you
1,Faggot stay away from this place forever
1,That moron failed again like always
1,Only a retard would believe your lies
1,Idiot I hope you get exposed soon
1,Dumbass you cannot do anything right
1,Pussy hiding behind a fake account
1,Prick nobody wants you anywhere near us
1,Garbage belongs in the bin not here
1,Worthless fool you have nothing to offer
1,Trash like you will never succeed
1,Scum like you disgust everyone around
1,Loser you will never amount to anything
1,Ugly face that makes children cry
1,Fatso stop eating like a starving pig
1,That hag should retire from public view
1,Witch go cast your evil elsewhere
1,Pig your smell reaches across the street
1,Dog you bark more than you think
1,Maggot crawling in other people’s business again
1,Cock head you talk too much rubbish
1,Jerk nobody wants your advice here
1,Freak you make people uncomfortable always
1,Creep stop stalking women on the internet
1,Evil creature go back to your hole
1,Pathetic fool you will die alone
1,Disgusting face that ruins my appetite
1,Bitchy attitude will get you slapped soon
1,Bastardly behaviour will ruin you completely
1,Scumbag you cannot be trusted ever
1,Stupid fool you failed yet again
1,Filthy animal stay far from my home
1,Tramp begging for attention everywhere you go
1,Hoe go find another street corner now
1,Psycho nobody is safe around you
1,Weakling afraid to face any challenge
1,Useless person wasting space on earth
1,Pervert staring at women like a dog
1,Animal should be kept in a cage
1,Looks like fashion gave up on you years ago
1,Seems intelligence skipped you completely
1,The internet is worse every time you post
1,No one asked for that low quality selfie
1,Looks like failure has a new poster child
1,Even a potato has more personality than you
1,Some faces were not meant for cameras
1,The mute button was invented because of people like you
1,Looks like life has been losing to you badly
1,Some people add value you remove it
1,Even background characters in movies have more relevance
1,Looks like poverty and arrogance had a baby
1,That face could stop a functioning elevator
1,Even a brick wall holds a better conversation
1,Looks like you lost the fight with common sense
1,Some achievements should remain hidden like yours
1,Even silence is more interesting than listening to you
1,Looks like you skipped the queue for brain cells
1,Some outfits should never leave the wardrobe
1,Even a school dropout makes more sense than you
1,Looks like bad luck follows you everywhere
1,Some posts should stay in the drafts forever
1,Even mosquitoes are less annoying than you
1,Looks like humility and you never met
1,Some smiles are proof of inner peace not yours
1,Even traffic is less stressful than being around you
1,Looks like disaster is your daily theme
1,Some videos are worth watching not the ones you post
1,Even shadows have more presence than you
1,Looks like boredom chose you as brand ambassador
1,Some ideas should never be shared
1,Even cartoons have more depth than your thoughts
1,Looks like you specialise in public embarrassment
1,Some reputations can be saved not yours
1,Even expired bread has more use than you
1,Looks like confidence without reason is your style
1,Some talents should be hidden forever
1,Even a broken fan works better than you
1,Looks like you are allergic to improvement
1,Some people just drain energy like you
1,Even rainwater has more purpose than your existence
1,Looks like wisdom has a restraining order against you
1,Some voices soothe the soul not yours
1,Even dust gets noticed more than you
1,Looks like mediocrity fits you perfectly
1,Some people bring peace you bring headache
1,Even a dead phone battery is more exciting
1,Looks like the clown industry is missing one member
1,Wow you must be proud of being the dumbest person online
1,Nice outfit did you steal it from a charity bin
1,Great job posting another picture nobody cares about
1,You must have worked hard to look this cheap
1,Your brain must be on vacation permanently
1,Congratulations on proving stupidity has no limits
1,You call that a joke that is adorable
1,Your sense of style is a crime against fashion
1,You must be the CEO of failure
1,Wow you actually posted that without shame
1,You make clowns look like fashion icons
1,Your confidence is inspiring considering how bad you look
1,Is this your face or a failed science experiment
1,You must be allergic to intelligence
1,Your talent is making bad decisions daily
1,Is being useless your full time career
1,You must have studied how to be irrelevant
1,Wow you managed to ruin another conversation
1,You are living proof that practice does not make perfect
1,You must have a PhD in embarrassing yourself
1,You really thought this post was a good idea
1,Your brain runs on expired batteries
1,Wow you found a way to look older and cheaper
1,You are like a pop up ad nobody wants you
1,Your selfies should be banned for public safety
1,Fuck you bitch you are nothing but trash
1,I will set you on fire and watch you burn
1,You are a stupid bastard who needs to vanish
1,I will drown you and watch you struggle
1,You deserve to be stabbed in the dark
1,I will bash your face until you are unrecognizable
1,You are a filthy dog that should be killed
1,I will poison you without hesitation
1,You deserve to die alone in the street
1,I will crush every bone in your body
1,You are a weak bastard who should be destroyed
1,I will kill you and dance on your grave
1,You deserve to bleed until there is nothing left
1,I will tear you apart piece by piece
1,You are a rotten whore who should vanish
1,I will make sure you never breathe again
1,You deserve to be slaughtered like an animal
1,I will cut you open and watch you fade
1,You are a bastard child of failure
1,I will beat you until your bones break
1,You deserve a violent death with no mercy
1,I will rip your life apart completely
1,I will break every bone in your useless body
1,I hope you get run over and left in the gutter
1,Fuck you and the miserable life you live
1,I will make you beg for death when I am done
1,You are a filthy bastard who deserves pain
1,I hope someone beats you until you cannot stand
1,I will drag your name through the mud until you disappear
1,You are a worthless piece of human garbage
1,I hope you suffer every single day of your pathetic life
1,I will ruin your life in ways you cannot imagine
1,You are so disgusting you make vomit look clean
1,I hope you die alone screaming for help
1,I will humiliate you until you break completely
1,You are the kind of trash that should be burned
1,I hope you rot in pain for the rest of your life
1,I will crush your spirit until nothing is left
1,You are a brainless animal pretending to be human
1,I hope you get slapped into the next century
1,I will expose you until even your family hates you
1,You are the biggest disgrace to ever breathe
1,I hope you choke on your own stupidity
1,I will make sure your life ends in shame
1,You are a useless coward hiding behind a screen
1,I hope you get beaten so bad you cannot speak
1,I will drag you through hell with my words
1,You are pure filth walking around in human skin
1,I hope every dream you have turns into dust
1,I will destroy your confidence beyond repair
1,You are an insult to everything alive
1,I hope you live long enough to regret existing
1,I will make you wish you were never born
1,You are a rotten bastard who deserves nothing good
1,I hope someone crushes your skull for talking
1,I will ruin your face so bad even mirrors reject you
1,You are a disgusting waste of oxygen
1,I hope your life collapses faster than a cheap building
1,I will make you cry blood before I am done
1,You are the dumbest living thing I have met
1,I hope you get beaten in front of everyone
1,I will make your name a joke for eternity
1,You are pathetic and too stupid to realize it
1,I hope you get kicked out of every place you enter
1,I will break you mentally and physically
1,You are the kind of fool people laugh at for fun
1,I hope someone ends your nonsense permanently
1,I will destroy your fake confidence in public
1,You are the reason stupidity still exists
1,I hope you never know peace until you die
1,Fuck you and your useless existence
1,You deserve to be slapped into next week
1,You are such a pathetic bastard
1,I will make sure everyone knows you are a bitch
1,Go kill yourself nobody will miss you
1,You are the dumbest fool I have ever seen
1,I will destroy your stupid little life
1,Your face makes me want to vomit
1,I hope you get beaten till you cannot walk
1,You are a worthless piece of shit
1,You should be ashamed to be alive
1,You act tough but you are a cowardly bitch
1,I will ruin your reputation beyond repair
1,You are a disgrace to your family
1,I hope you fail at everything forever
1,I will embarrass you publicly till you cry
1,You are nothing but a sad little loser
1,I hope you choke on your own lies
1,You deserve every bad thing coming to you
1,I will make your life hell every single day
1,You are the most useless bastard in this group
1,I wish someone would knock sense into your skull
1,Your stupidity is beyond medical help
1,I hope you get exposed for the fake you are
1,You should never show your ugly face again
1,You are an embarrassment to humanity
1,One day you will regret being such a bitch
1,I will laugh when your life falls apart
1,You are just trash pretending to be human
1,I hope you lose everything you value
1,You deserve to be humiliated daily
1,Your brain is pure garbage
1,I will crush your ego into dust
1,You are living proof that stupidity is real
1,I hope karma hits you harder than a truck
1,You should be banned from speaking forever
1,You are a disgusting waste of space
1,I hope you get exactly what you deserve
1,You are the biggest idiot I know
1,I will expose every dirty secret you have
1,Your face is proof that evolution can go wrong
1,I wish you the worst life possible
1,You should be punched for existing
1,You are the reason people lose faith in humanity
1,I will make you regret crossing me
1,Your mouth is full of nothing but lies
1,I hope someone teaches you pain the hard way
1,You are pathetic and everyone knows it
1,I will make sure you never recover from this
1,You try so hard yet you still look cheap
1,Your photos look like they were taken with a torchlight
1,You have the personality of a broken chair
1,Your shoes look like they were rescued from the trash
1,You always talk but never say anything useful
1,Your outfit looks like it was picked in the dark
1,Your handwriting looks like a child scribbled it
1,You think you are smart but you always fail
1,Your pictures are so blurry they hurt my eyes
1,You act rich but your life tells another story
1,Your hairstyle looks like it was done for free by a learner
1,Your voice is so irritating it could break glass
1,You always manage to make everything about yourself
1,Your bag looks like it has been used for ten years
1,Your posts are so boring no one even reads them
1,You look like you have not slept in weeks
1,Your makeup looks like it was done in a moving car
1,You think you are famous but no one knows you
1,Your comments always make you look foolish
1,Your dancing looks like you are fighting invisible enemies
1,You always act like you are better than everyone
1,Your clothes look like they were borrowed from a clown
1,You post so much yet no one cares
1,Your smile looks forced and fake
1,You are always online yet never improving your life
1,Your fashion sense is stuck in the last decade
1,Your face looks like it needs a software update
1,You act confident but your insecurity shows
1,Your jokes are so bad they should be illegal
1,You always need attention but never have value
1,Your photos look like a crime scene
1,You pretend to be kind but you are just fake
1,Your room in the background says more than your words
1,You are proof that money cannot buy class
1,Your attitude is as empty as your wallet
1,You think you are stylish but you are just mismatched
1,Your profile picture is the worst part of my day
1,You always look tired even when you are smiling
1,Your captions make you sound desperate
1,You post quotes you clearly do not understand
1,Your hair looks like it lost a fight
1,You always ruin group photos with your face
1,Your confidence is as fragile as glass
1,You pretend to be busy but do nothing
1,Your picture filters are working overtime
1,You act like a boss but still beg for help
1,Your handwriting looks like medical prescriptions
1,You think you are intimidating but you are just loud
1,Your advice is as bad as your decisions
1,You better watch out or I’ll smash your face in after school.
1,You’re so useless nobody even notices you in this class.
1,Hand over your money now or I’ll break your legs.
1,Your fake clothes make you look like a complete joke.
1,We all hate you because you’re too poor to fit in.
1,I’ll blast your ugly photo across Instagram for everyone to laugh.
1,You’re so dumb your brain must be empty.
1,Do my work or I’ll tell the whole school you’re a thief.
1,Stop acting rich when you’re just a broke pretender.
1,Open your mouth again and I’ll knock your teeth out.
1,Your hair is so messy you look like a mad person.
1,You’re too low-class to ever join our crew.
1,I’ll leak your embarrassing chat to make you a laughingstock.
1,You village rat what are you doing in this city party?
1,Give me your bag or I’ll throw it in the dustbin.
1,You walk like a clown everyone is laughing at you.
1,Do what I say or I’ll tell the teacher you cheated.
1,I’ll post your photo online with a caption calling you trash.
1,You’re a nobody in this office stop acting important.
1,Your stupid accent makes you sound like an idiot.
1,Your phone is so cheap it’s embarrassing to be seen with you.
1,Let me copy your answers or I’ll ruin your name.
1,Your TikTok videos are so pathetic they’re a disgrace.
1,You’re so tiny you’re invisible in this school.
1,Obey me or I’ll kick you out of the group chat forever.
1,Your family is so broke you’re a burden in this school.
1,I’ll share your clumsy video online to humiliate you.
1,You’re so ugly you scare everyone away.
1,Give me your food or I’ll shove you into the wall.
1,You’re so quiet because you’ve got nothing smart to say.
1,I’ll tell everyone you begged for money to shame you.
1,Your shoes are so worn out you look homeless.
1,You’re not welcome here get lost from our table.
1,I’ll comment on your post calling you a fake for all to see.
1,You’re too weak to ever play with us you loser.
1,Why try so hard when you’re destined to fail every test?
1,I’ll spread a rumor you’re in love to make you a joke.
1,Your bag is so tattered it belongs in the trash.
1,Buy me something or I’ll make sure everyone hates you.
1,You’re so useless you’ll never move up in this company.
1,I’ll tag you in a meme that calls you a failure online.
1,Your voice is so annoying you should never speak again.
1,Give me your book or I’ll shred it to pieces.
1,Everyone despises you because you act like a know-it-all.
1,I’ll send your photo to everyone labeling you a fool.
1,You’re too pale you ruin our group pictures.
1,Do as I say or I’ll make your life a living hell.
1,Your English is so terrible you sound illiterate.
1,I’ll hack your account and post garbage to destroy you.
1,You’re such a nobody you’re wasting space at this event.
1,You always trip me when I walk past you in the hallway.
1,Nobody wants to be your friend because you smell bad.
1,Hand over your pocket money or I’ll punch you after class.
1,Your hairstyle is so ugly it makes everyone laugh.
1,We won’t let you join our team because you’re too poor.
1,I’ll share your old photo online to make people mock you.
1,You’re so stupid you’ll never pass any exam in this school.
1,Do my project or I’ll tell everyone you cheated on the test.
1,Why are you pretending to be rich with that fake watch?
1,Keep quiet in the group or I’ll hit you after school.
1,Your uniform is so faded you look like a beggar.
1,You can’t hang out with us because you talk like a villager.
1,I recorded your voice note and I’ll post it to embarrass you.
1,What’s a small boy like you doing at this big event?
1,Give me your lunch or I’ll throw your bag out the window.
1,You walk so clumsily everyone thinks you’re a fool.
1,Obey me or I’ll tell the teacher you stole her marker.
1,I can edit your photo to make you look like a clown online.
1,You’re just a junior staff why act like the boss here?
1,Your accent is so funny you can’t join our discussion.
1,Your phone is so old it’s embarrassing to hold it.
1,Let me cheat in the exam or I’ll spread lies about you.
1,Your dance video on TikTok is so bad it’s a joke.
1,You’re too tall you look awkward in this class photo.
1,Do what I say or I’ll remove you from the WhatsApp group.
1,Your family is broke why do you even attend this school?
1,I have a video of you tripping I’ll post it to shame you.
1,You’re so unattractive nobody wants you in their group.
1,Give me your charger or I’ll push you down the stairs.
1,Why are you so shy are you too dumb to speak up?
1,I’ll tell everyone you failed the quiz to humiliate you.
1,Your socks are so torn do you even wash them?
1,You’re not cool enough to sit with us at lunch.
1,I’ll write on your post that you’re a liar for everyone to see.
1,You’re too weak to join our basketball game ever.
1,Why bother studying when you’re always last in class?
1,I’ll tell the school you have a crush to embarrass you.
1,Your school bag is so ugly it looks like trash.
1,Buy me snacks or I’ll make sure everyone ignores you.
1,You’re so lazy you’ll never succeed in this company.
1,I’ll tag you in a funny meme to make people laugh at you.
1,Your singing is terrible stop trying to perform.
1,Give me your textbook or I’ll rip your assignment.
